model,run_id,question,latency_s,answer,sql,error
gemini-3-flash-preview,1,Rank customers by total withdrawal amount and show the top 5,2.894,"[{'type': 'text', 'text': 'Here are the top 5 customers ranked by their total withdrawal volume, with James Wilson significantly leading the group.\n\n1. James Wilson: $149,483.53\n2. Raj Patel: $28,147.65\n3. Kenji Sato: $7,529.11\n4. Maria Santos: $5,000.00\n5. Sarah Chen: $4,379.66\n\nWould you like me to check if any of these high-volume withdrawals were flagged for manual review?', 'extras': {'signature': 'EjQKMgG+Pvb7byVykK+qWcyb7y+FdnxO0kidRw1FgkLNf0FXQH/YCwD6NfT/ws7lGwBtUXZd'}}]","{'query': 'SELECT c.name, SUM(w.amount) as total_withdrawn, w.currency\nFROM customers c\nJOIN withdrawals w ON c.id = w.customer_id\nGROUP BY c.name, w.currency\nORDER BY total_withdrawn DESC\nLIMIT ",
gemini-3-flash-preview,1,Do customers who use VPNs have higher withdrawal amounts on average?,3.274,"[{'type': 'text', 'text': 'Based on the current data, customers using VPNs actually have significantly lower withdrawal amounts on average compared to those who do not.\n\n1. **Non-VPN Users:** Average withdrawal of $3,420.65 (75 withdrawals)\n2. **VPN Users:** Average withdrawal of $500.00 (6 withdrawals)\n\nWhile the average is lower for VPN users, the sample size for confirmed VPN transactions is currently quite small. Would you like me to check if these VPN-based withdrawals were flagged for review or if they originated from high-risk countries?', 'extras': {'signature': 'EjQKMgG+Pvb7UBYqDVuFAxNVEobBgRyYsDoiDUEjJNQnQPrKlzciPXn3a1IyJc4Bi+UA+Sup'}}]","{'query': 'SELECT \n    ih.is_vpn, \n    COUNT(DISTINCT w.id) as withdrawal_count,\n    AVG(w.amount) as average_withdrawal_amount\nFROM withdrawals w\nJOIN ip_history ih ON w.customer_id = ih.custome",
gemini-3-flash-preview,1,"Show me all customers who made withdrawals on February 1st, 2020",2.991,"[{'type': 'text', 'text': 'On February 1st, 2020, there were no recorded withdrawal requests in the system.\n\nWould you like me to check for withdrawals on a different date, or perhaps look for the most recent activity instead?', 'extras': {'signature': 'EjQKMgG+Pvb7yrUr3o+ZkhtLkqaT6squOB/LU6+hu+rYqogdncgtJD/PsllGJYjQVlneveo+'}}]","{'query': ""SELECT DISTINCT c.name, c.email, w.amount, w.currency, w.status\nFROM customers c\nJOIN withdrawals w ON c.id = w.customer_id\nWHERE w.requested_at >= '2020-02-01 00:00:00' AND w.requested_",
gemini-3-flash-preview,1,Find blocked withdrawals that were approved,3.653,"[{'type': 'text', 'text': 'I found no withdrawals that were marked as ""blocked"" by the fraud system but still reached an ""approved"" workflow status. This suggests that your blocking controls are working correctly and preventing high-risk payouts from being processed.\n\nWould you like me to check for any ""escalated"" withdrawals that were approved, or should I look for blocked attempts from this past week?', 'extras': {'signature': 'EjQKMgG+Pvb7TipHPFTN8WblgNj679dkSWJxlKoI229O0B6MnRCtSpaJm84TqEarEuHPFIXm'}}]","{'query': ""SELECT w.id, w.amount, w.currency, w.recipient_name, wd.decision, w.status, wd.decided_at\nFROM withdrawals w\nJOIN withdrawal_decisions wd ON w.id = wd.withdrawal_id\nWHERE wd.decision = '",
gemini-3-flash-preview,1,What's the correlation between velocity and fraud?,4.058,"[{'type': 'text', 'text': 'High-risk and fraudulent withdrawals actually show a slightly lower frequency per customer (1.67) compared to approved ones (1.91) over the last 90 days, though they involve smaller, more frequent attempts to test the system.\n\n1. **Approved Withdrawals:** 21 total requests from 11 customers (1.91 per customer), averaging $1,817.\n2. **Fraudulent/High Risk:** 10 total requests from 6 customers (1.67 per customer), averaging $1,090.\n\nWhile the frequency is similar, the lower average amount for high-risk cases suggests ""smurfing"" or testing behavior. Would you like me to check if these high-risk customers are using the same device or IP address?', 'extras': {'signature': 'EjQKMgG+Pvb7ngO13XmV61jlmTEaMHjOaISx+XKZykrBA9qBZKzkWHoZRAkfLxKIKU7G1Vxx'}}]","{'query': ""SELECT \n    CASE \n        WHEN wd.decision IN ('blocked', 'escalated') THEN 'Fraudulent/High Risk'\n        ELSE 'Approved'\n    END as decision_type,\n    COUNT(w.id) as total_withdrawal",
gemini-3-flash-preview,1,Show me the top 5 highest risk customers,6.773,"[{'type': 'text', 'text': 'These are the top 5 customers with the highest risk scores based on recent withdrawal evaluations.\n\n1. Victor Petrov (victor.petrov@example.com) — Risk Score: 0.55 (1 evaluation)\n2. Carlos Mendez (carlos.mendez@example.com) — Risk Score: 0.55 (5 evaluations)\n3. Fatima Nour (fatima.nour@example.com) — Risk Score: 0.55 (1 evaluation)\n4. Ahmed Hassan (ahmed.hassan@example.com) — Risk Score: 0.55 (1 evaluation)\n5. Sophie Laurent (sophie.laurent@example.com) — Risk Score: 0.55 (1 evaluation)\n\nWould you like me to check the specific risk indicators for Carlos Mendez, given his high number of evaluations?', 'extras': {'signature': 'EjQKMgG+Pvb7XUc4s7kwasi9lbbczP+ubn21ulnciInVgPLsK/cLLfBk+jCtHHwbwvay8zvb'}}]","{'query': 'SELECT c.name, c.email, MAX(a.risk_score) as max_risk_score, COUNT(a.id) as alert_count\nFROM customers c\nJOIN alerts a ON c.id = a.customer_id\nGROUP BY c.id, c.name, c.email\nORDER BY ma; {'query': 'SELECT c.name, c.email, MAX(a.risk_score) as max_risk_score, COUNT(a.id) as alert_count\nFROM customers c\nJOIN alerts a ON c.id = a.customer_id\nGROUP BY c.id, c.name, c.email\nORDER BY ma; {'query': 'SELECT c.name, c.email, MAX(wd.composite_score) as max_risk_score, COUNT(wd.id) as decision_count\nFROM customers c\nJOIN withdrawals w ON c.id = w.customer_id\nJOIN withdrawal_decisions wd",
